[
  {
    "run_state_id": "run_level1_service_halls_v0",
    "level_id": "level1_service_halls",
    "loot_table_id": "loot_level1_basic",
    "entity_ids": ["entity_flicker_stalker"],
    "extraction_ids": [
      "extract_level1_stable_service_door",
      "extract_level1_hidden_ticket_booth"
    ],
    "sanity_rule_id": "sanity_level1_service_halls_v0",
    "description": "Prototype run definition for the first extraction loop."
  }
]
